job_title,company,job_location,job_summary,today,job_salary,extracted_skills,yearly_salary
python data science/java/web designing trainer,MISNT Services Pvt.Ltd.,"Dehra Dun, Uttarakhand","Python Data Science /Artificial Intelligence /Machine learning /Java.,Survey Chowk, Dehra Dun - 248001, Uttarakhand: Reliably commute or planning to relocate…",2022-07-26,"₹15,000 - ₹35,000 a month","['python', 'machine learning']",300000.0
data analyst,Honeywell,"Bengaluru, Karnataka+1 location","Have 2 to 4 years of data engineering experience in any data warehousing platform.,You will work on a team including scrum masters, product owners, data…",2022-07-26,Not Disclosed,[],
programmer analyst (junior),FENG GROUP,"Patna, Bihar+1 location","Ability to understand functional/technical specifications and analyze data;,Our Client is from a Financial Services company that is looking for a passionate…",2022-07-26,Not Disclosed,[],
data science,VFI SLK,"Bengaluru, Karnataka",Voya’s Data Science Infrastructure and Implementation Team (DSIIT) develops solutions to maximize productivity of Voya’s data science function.,2022-07-26,Not Disclosed,[],
data science consultant,Blue Yonder,"Bengaluru, Karnataka","Experience with data visualization tools, such as D3.js.,Experience with common data science toolkits, such as Python, R, Weka, NumPy, MatLab, etc.",2022-07-26,Not Disclosed,"['python', 'data visualization', 'numpy', 'r']",
gis data analyst,Carifer Technologies,"Erode, Tamil Nadu","Produce reports on geographic data utilizing data visualizations.,Designing digital maps with geographic data and other data sources.",2022-07-26,"₹2,00,000 - ₹3,00,000 a year",[],250000.0
data scientist,MAHIRA RESOURCES PRIVATE LIMITED,"Hyderabad, Telangana","Create automated systems for data error detection.,Proven ability to work with large, complex data.,Lead development of end-to-end streaming- and batch-data…",2022-07-26,Not Disclosed,[],
data engineer: enterprise content management,IBM,"Gurgaon, Haryana+6 locations","To think along with clients and sell.,As an OpenText Solution Architect, you will work in large-scale and complex business and technical environments,…",2022-07-26,Not Disclosed,[],
data science specialist,GE Aviation,"Bengaluru, Karnataka","Work with data engineers on data quality assessment, data cleansing and data analytics.,Develop data science models to address supply chain and engine fleet…",2022-07-26,Not Disclosed,[],
data science,Zee Entertainment Enterprises,"Bengaluru, Karnataka",Preferred: Ideally Masters or higher but we are flexible with candidates having right experience; Familiarity with model building lifecycle and deployment in…,2022-07-26,Not Disclosed,[],
associate data science engineer,Gramener,"Hyderabad, Telangana","Feel the thrill of using data to tell stories.,Learn the ropes of converting Data Problems to Data Answers using AI/ML.,Any graduate or final year student.",2022-07-26,Not Disclosed,[],
lead data analyst,Mercedes-Benz Research and Development India...,"Bengaluru, Karnataka",Data Factory: experience using data factory in an enterprise solution to build data pipelines would be an added advantage.,2022-07-26,Not Disclosed,[],
data scientist,Pfizer,"Chennai, Tamil Nadu",Emphasis will be on application of artificial intelligence (AI) systems and predictive modelling techniques across the drug development continuum using…,2022-07-26,Not Disclosed,[],
"trainee analyst, ds&m",GSK,"Bengaluru, Karnataka","Awareness of converting structured and unstructured data from various sources.,Thorough computer skills, understanding of general data flow & interfaces.",2022-07-26,Not Disclosed,[],
case quality management,IQVIA,"Bengaluru, Karnataka","; must have excellent oral and written skills in English • Working knowledge of Pharmacovigilance databases, ICSR processing conventions and coding; strong…",2022-07-26,Not Disclosed,[],
data science trainer,Innomatics Research Labs,"Hyderabad, Telangana","Minimum 4+ Years of experience in machine learning & data analytics.,Expert knowledge in Python, Statistics, Machine Learning, Artificial Neural Networks,…",2022-07-26,"₹10,00,000 a year","['python', 'machine learning', 'statistics']",1000000.0
junior data science team member,Imurgence,India,"Experience with common data science toolkits, such as R desirable.,Analyse data to help in better descision making.,Knowledge or experience of how APIs work.",2022-07-26,Not Disclosed,['r'],
data scientist,Visa,"Temporarily Bengaluru, Karnataka",The person should have understanding and appreciation of data engineering concepts and systems while being an expert (beyond knowledge of libraries) in data…,2022-07-26,Not Disclosed,[],
data scientist,Shell,"Bengaluru, Karnataka","Moreover, it’s a technical job where you’ll need to apply advanced statistical analysis and predictive analytics to real-life business problems.",2022-07-26,Not Disclosed,[],
bps- data & ai,IBM,"Mumbai, Maharashtra",Collecting and analyzing data to learn more about Clients Strategic Imperatives and designing a focused Short- & Long-Term Account Plan.,2022-07-26,Not Disclosed,[],
manager - data science and analytics (insights),TransUnion,"Mumbai, Maharashtra+1 location","This role will work on analytics solutioning, design, build and implementation for custom reporting and analytics as per client needs, working closely with…",2022-07-26,Not Disclosed,[],
data science people analytics,Unisys,"Bengaluru, Karnataka","Apply your expertise in people research, quantitative analysis, data science and data visualization.,Experience in conducting primary and secondary research…",2022-07-26,Not Disclosed,['data visualization'],
data scientist,HP,"Bengaluru, Karnataka","Work on multiple projects requiring data engineering & data science solutions development.,Contributes to industry data science domain initiatives.",2022-07-26,Not Disclosed,[],
data science- corporate trainer,Synergy plus business group consultant,"Delhi, Delhi","Data science-trainer: 5 years (Required).,*We are looking for a Data Science Corporate trainer.*.,Note: Prior online training experience is a must.*.",2022-07-26,"₹3,250 an hour",[],
data analyst,Culture Arc,"Bengaluru, Karnataka","Acquire data from primary or secondary data sources and maintain databases/data systems.,Technical expertise regarding data models, database design development,…",2022-07-26,Not Disclosed,[],
restartwithinfosys-india-dell boomi,Infosys Limited,"Bengaluru, Karnataka","Ability to work with clients to identify business challenges and contribute to client deliverables by refining, analyzing, and structuring relevant data •…",2022-07-26,Not Disclosed,[],
consulting analyst,Great Place to Work,"Bengaluru, Karnataka+1 location","Data analysis: identify, analyze and interpret data from surveys, workshops, participant feedback and progress during long term engagement.",2022-07-26,Not Disclosed,['data analysis'],
data privacy officer (junior),FENG GROUP,"Bengaluru, Karnataka+1 location","Working collaboratively with the internal compliance team for data privacy compliance requirements;,Basic knowledge of data privacy compliance requirements like…",2022-07-26,Not Disclosed,[],
data base administrator (sql/postgres sql dba),Albanero Dev Private Limited,"Hyderabad, Telangana","Relevant Experience Required: * 2.5- 7 years.,Bachelor's Degree in Computer Science or Computer Engineering.,Expertise in writing and optimising SQL statements,…",2022-07-26,"₹7,00,000 - ₹15,00,000 a year",['sql'],1100000.0
business insights analyst,Masalabox Food Network Private Limited,"Bengaluru, Karnataka",Understand the visualization requirements of the team and accordingly prepare the data strategies to pull and present the required information.,2022-07-26,"₹50,000 - ₹65,000 a month",[],690000.0
data science trainer-big data,Presidency Digital India Pvt. Ltd.,"Navi Mumbai, Maharashtra",Translate complex functional and technical requirements into detail design Implementing ETL process for integration of data from disparate sources.,2022-07-26,"₹4,00,000 - ₹7,00,000 a year",['etl'],550000.0
application developer: jd edwards,IBM,"Kolkata, West Bengal+2 locations","Ability to drive workshops, obtain requirements & perform gap analysis, create design, prepare & execute testing & data conversion,.",2022-07-26,Not Disclosed,[],
junior ml/ data science engineer,mStack Inc,"Kochi, Kerala","We are looking for data science engineers who have strong interest in data science.,Acquire data from primary or secondary data sources and perform data tagging…",2022-07-26,"₹10,000 - ₹20,000 a month",[],180000.0
application architect: data platforms,IBM,"Hyderabad, Telangana+3 locations","Proven ability in multiple disciplines of data warehousing such as data access, ETL and data management.,Responsible for Hadoop development and implementation…",2022-07-26,Not Disclosed,"['hadoop', 'etl']",
data scientist,Intuit,"Bengaluru, Karnataka","2+ years experience with data science.,You must be comfortable partnering with those directly involved with big data infrastructure, software, and data…",2022-07-26,Not Disclosed,['big data'],
lead- data science,MMC Corporate,"Mumbai, Maharashtra","Advanced knowledge of script editor to connect and retrieve data from various data sources at the extraction stage.,6 months instalment option through payroll.",2022-07-26,Not Disclosed,[],
associate - qr strats data analytics - apac,Morgan Stanley,"Mumbai, Maharashtra","Automate construction of complex data models consisting of data from diverse data sources across the firm.,An understanding of feature engineering from data.",2022-07-26,Not Disclosed,[],
data scientist level-2,Ignatiuz Software Pvt. Ltd,"Indore, Madhya Pradesh","3+ years of hands-on experience with data science or analytics in a business context.,Aptitude for data manipulation and Exploratory analysis techniques;…",2022-07-26,Not Disclosed,[],
"manager, data science 2",PayPal,"Bengaluru, Karnataka","Leveraging data analysis tools and technologies.,Ensuring the team is delivering on our KPIs by using various data mining and data visualization tools to…",2022-07-26,Not Disclosed,"['data visualization', 'data analysis']",
data engineer,BI3 Technologies India Pvt Ltd,"Chennai, Tamil Nadu","Ø Work with data and analytics experts to strive for greater functionality in our data systems.,Ø Build the infrastructure required for optimal extraction,…",2022-07-26,"₹7,00,000 a year",[],700000.0
data science consultant lead,Serendipity Corporate Services,"Pune, Maharashtra","Understanding of data structures, data modelling and software architecture.,Transforming data science prototypes and applying appropriate ML algorithms and…",2022-07-26,Not Disclosed,[],
data scientist,tiket.com,India,"Knowledge of data science concepts (regression, classification, clustering,.,Mining/data analysis methods, using a variety of data tools, building and.",2022-07-26,Not Disclosed,['data analysis'],
data science- ai product,Spectral Consultants,"Bengaluru, Karnataka","Owning the development of AI component within product for accuracy & efficiency.,Involve in research & conceptualization & product design for new product line.",2022-07-26,Not Disclosed,[],
data scientist,Resource Tree,"Chennai, Tamil Nadu","Experience in *different visualization techniques, data profiling and data validation*.,Researching solutions to overcome data analytics challenges.",2022-07-26,"₹20,00,000 a year",[],2000000.0
data scientist,drivebuddyAI,Remote,"Work with data storage like SQL & NoSQL DBs.,Experience with mathematical models for data patterns & profiling.,Data gathering, analysis & report generations.",2022-07-26,"₹15,00,000 a year",['sql'],1500000.0
data science analytics manager,Accenture,"Gurgaon, Haryana+1 location","I Design and implement scalable data repositories to integrate qualitative and quantitative research data.,I Create foundational data capabilities by leveraging…",2022-07-26,Not Disclosed,[],
l3 consultant data science - remote,Aliqan Technologies,"Bengaluru, Karnataka",The ideal candidate will be responsible for creating data driven solutions that at the core are driven by relevant learning algorithms.,2022-07-26,"₹12,00,000 - ₹23,00,000 a year",[],1750000.0
senior specialist - data science,Accelya,"Pune, Maharashtra","Assess the effectiveness and accuracy of new data sources and data gathering techniques.,Develop custom data models and algorithms.",2022-07-26,Not Disclosed,[],
associate test engineer,IQVIA,"Bengaluru, Karnataka","Develops and executes test plans and scripts to confirm the quality and success of various technologies.,Manual and automated testing of applications and web…",2022-07-26,Not Disclosed,[],
data & analytics analyst,NatWest Group,"Gurgaon, Haryana+2 locations","Knowledge of data engineering, data science and decisioning disciplines.,Sharing relevant updates with key stakeholders bringing together advanced analytics,…",2022-07-26,Not Disclosed,[],
data science analytics manager,Accenture,"Gurgaon, Haryana+1 location","I Design and implement scalable data repositories to integrate qualitative and quantitative research data.,I Create foundational data capabilities by leveraging…",2022-07-26,Not Disclosed,[],
senior specialist - data science,Accelya,"Pune, Maharashtra","Assess the effectiveness and accuracy of new data sources and data gathering techniques.,Develop custom data models and algorithms.",2022-07-26,Not Disclosed,[],
associate test engineer,IQVIA,"Bengaluru, Karnataka","Develops and executes test plans and scripts to confirm the quality and success of various technologies.,Manual and automated testing of applications and web…",2022-07-26,Not Disclosed,[],
data & analytics analyst,NatWest Group,"Gurgaon, Haryana+2 locations","Knowledge of data engineering, data science and decisioning disciplines.,Sharing relevant updates with key stakeholders bringing together advanced analytics,…",2022-07-26,Not Disclosed,[],
python developer – fresher,IntelloGrit,Remote,"Implement security and data protection solutions.,We are looking for a Python Developer to join our engineering team and help us develop and maintain various…",2022-07-26,Not Disclosed,['python'],
data scientist,Bosch Group,"Bengaluru, Karnataka","Experience: At least 2 years of experience of professional data science.,Enthusiasm: Passion for data science and advanced analytics, developing…",2022-07-26,Not Disclosed,[],
data engineer,Walmart Global Tech India,"Bengaluru, Karnataka+1 location","Our Data Engineering team comes in to help Walmart manage this data, by building pipelines and data lakes to prepare big data for analysis, they help unlock…",2022-07-26,Not Disclosed,['big data'],
data scientist,BEIING,"Delhi, Delhi","Collaborate with and influence leadership to ensure data science directly impacts strategy.,The ideal candidate would be someone who has worked in a data…",2022-07-26,"₹50,00,000 - ₹60,00,000 a year",[],5500000.0
assistant manager data integrity - hyderabad,Deloitte,"Hyderabad, Telangana","Provides end-to-end support around database management, data visualization, data science, data reporting and technology development.",2022-07-26,Not Disclosed,['data visualization'],
data engineer 1,JLL,"Bengaluru, Karnataka","Design & develop data management and data persistence solutions for application use cases leveraging relational, non-relational databases and enhancing our data…",2022-07-26,Not Disclosed,[],
data science associate,BlissClub,"Bangalore Urban, Karnataka","Build a deep understanding of levers of those metrics, by diving into data and customer interactions.,Own the measurement of key business metrics, across…",2022-07-26,Not Disclosed,[],
data engineer (web scraping),Whitetail Technologies,"Bengaluru, Karnataka","As a data engineer who is focused on web-scraping, you will be responsible for extracting and ingesting data from websites and data-sources using web crawling…",2022-07-26,"₹4,00,000 - ₹6,00,000 a year",[],500000.0
data science trainer,Baroda Institute of Technology,"Vadodara, Gujarat","Candidate should have exposure to Python, data analytics, data science, Machine learning, Deep Learning.,Data science: 1 year (Preferred).",2022-07-26,"₹25,000 - ₹50,000 a month","['python', 'machine learning', 'deep learning']",450000.0
associate data analyst,UnitedHealthcare,"Bengaluru, Karnataka","Analyze data to identify trends, patterns, insights, and discrepancies in data; ensure data accuracy, synthesize compliance data in support of strategic…",2022-07-26,Not Disclosed,[],
specialist - data sciences,Larsen & Toubro Infotech Limited,"Delhi, Delhi","Understanding of data and data analysis; experience with large data sets.,Deliver ownership to setup ML / NLP models with respect to tools, data and…",2022-07-26,Not Disclosed,"['nlp', 'data analysis']",
data engineer,Johnson Electric,"Chennai, Tamil Nadu","Good knowledge of data processing and data visualization (preferably Power BI).,Support the team in drafting, communicating and enforcing standards for data…",2022-07-26,Not Disclosed,"['power bi', 'data visualization']",
adjunct faculty - data science (remote),eduCLaaS,"New Delhi, Delhi","Data science trainer: 3 years (Required).,3+ years of experience in data science and machine learning.,O Azure Machine Learning knowledge especially with data…",2022-07-26,Not Disclosed,"['machine learning', 'azure']",
data science trainer,Synergy plus business group consultant,"Bengaluru, Karnataka","Data science: 10 years (Required).,We are looking for - Data science Corporate Trainer.*.,CTC: Up to 16 LPA.*.",2022-07-26,"₹16,00,000 a year",[],1600000.0
data scientist,OneBanc Technologies,"Gurgaon, Haryana","Practical experience with SAS, ETL, data processing, database programming and data analytics.,Research and develop statistical learning models for data analysis…",2022-07-26,Not Disclosed,"['etl', 'data analysis']",
associate manager - data science,Standard Chartered,"Bengaluru, Karnataka","Ensure data security and data sharing in a secured manner.,The role involves extensive data processing and analysis leveraging multiple relevant data sources.",2022-07-26,Not Disclosed,[],
data scientist,Isquare Soft,"Bengaluru, Karnataka","Knowledge of data structures, relational data, and big data platforms.,We are looking for a strong Data Scientist with 5+ years of experience to support…",2022-07-26,"₹15,00,000 - ₹25,00,000 a year",['big data'],2000000.0
jbpm / camunda consultant,Infosys Limited,"Bengaluru, Karnataka+1 location","Ability to work with clients to identify business challenges and contribute to client deliverables by refining, analyzing, and structuring relevant data •…",2022-07-26,Not Disclosed,[],
data scientist,Honeywell,"Bengaluru, Karnataka","Mine and analyze data from company databases to drive optimization and improvement of data quality.,Enhancing data quality using AI/ML based approaches.",2022-07-26,Not Disclosed,[],
junior business analyst,Khelo Tech & Strategy Pvt Ltd,"Delhi, Delhi","Handle tough technical problems and data issues.,Adhere to company data functional and user interface standards in the design of application user interface,…",2022-07-26,"₹25,000 - ₹33,000 a month",[],348000.0
genesys expert,Infosys Limited,"Hyderabad, Telangana","Ability to work with clients to identify business challenges and contribute to client deliverables by refining, analyzing, and structuring relevant data •…",2022-07-26,Not Disclosed,[],
data architect,Publicis Groupe,"Gurgaon, Haryana","This will be a data-focused role that involves working with clients on data/audience strategy, data onboarding and data audience insights as well as internally…",2022-07-26,Not Disclosed,[],
data engineer azure,IBM,"Gurgaon, Haryana","Delivered ETL solution including data extraction, transformation, cleansing, data integration and data management.",2022-07-26,Not Disclosed,['etl'],
technology analyst (react js),Infosys Limited,"Hyderabad, Telangana","Bachelors or Masters in Engineering or related technical field (Computer science).,Develop and deliver applications/projects on time and with very high code…",2022-07-26,Not Disclosed,[],
software tester,Virginia Transformer Corp.,"Delhi, Delhi","G) SQL/ Access knowledge will be an additional benefit in case scripts needs to be generated to validate data from databases.,F) Writing UAT test cases.",2022-07-26,Not Disclosed,['sql'],
data science trainer,London International Studies and Research Center,"Delhi, Delhi","Strong, practical data analysis and data science skills.,Minimum of 3-5 years’ experience delivering highly technical courses for our key personas (software…",2022-07-26,Not Disclosed,['data analysis'],
actuarial data analyst,iptiQ,"Bengaluru, Karnataka","Build algorithms and data models to translate effective findings in reproducible analytics.,You have applied these skills using real business data to develop…",2022-07-26,Not Disclosed,[],
data science trainer,Eagletfly Solutions,"New Delhi, Delhi","Looking for Data Science & analytics Trainers weekends batches to teach ""Python, Data Science/Analytics, Machine Learning, Deep Learning / Artificial…",2022-07-26,"₹15,000 - ₹30,000 a month","['python', 'machine learning', 'deep learning']",270000.0
research analyst - esg data solutions-2,FactSet Research Systems,"Hyderabad, Telangana","Collect, analyze and process company reported data from various data sources and into the database utilized by the ESG content team.",2022-07-26,Not Disclosed,[],
azure data engineer,ITC Infotech India Ltd,"Bengaluru, Karnataka","Proven experience in Azure Cloud and its components.,Good Exposure of ADLS and Data and Delta Lake.,Good Exposure on ADF /ADB /Synapse.",2022-07-26,Not Disclosed,['azure'],
"manager, data science",Standard Chartered,"Bengaluru, Karnataka","Ensure data security and data sharing in a secured manner.,The role involves extensive data processing and analysis leveraging multiple relevant data sources.",2022-07-26,Not Disclosed,[],
data engineer - planetrics,McKinsey & Company,"Bengaluru, Karnataka","Experience developing production data pipelines and productionising data-science models.,In this role, you will work with financial data, terabytes of global…",2022-07-26,Not Disclosed,[],
data science,Shifastar,"Mumbai, Maharashtra","Experience with preprocessing of data for machine learning.,Design, Development and Deployment of new Machine Learning Solutions.",2022-07-26,Not Disclosed,['machine learning'],
etl/data engineer,Eastvantage,"Bengaluru, Karnataka","Comfortable with using Python on data and analytics needs.,Comfortable with using Python on data and analytics needs.,Experience in working with the AWS Suite.",2022-07-26,"₹8,00,000 a year","['python', 'aws']",800000.0
clinical data manager iii,Clinipace,India,"Developing data management guidelines and study documentation.,Identification of data issues and query generation.,Review of CRF design against protocol.",2022-07-26,Not Disclosed,[],
director - data science and business analytics,Standard Chartered,"Bengaluru, Karnataka","Drive Innovation by incorporating AI, Machine Learning, and data science frameworks to leverage the power of data.,Experience/Exposure with big data technology.",2022-07-26,Not Disclosed,"['machine learning', 'big data']",
big data administrator,Valiance Solutions,"Noida, Uttar Pradesh","Using strong data science, data engineering & cloud engineering.,Hands-on experience with Hadoop deployment.,Ambari, Hive, Nifi, Spark, etc.",2022-07-26,Not Disclosed,"['hadoop', 'spark']",
senior manager data analytics,GSK,"Bengaluru, Karnataka","Responsible to develop a data governance framework, including data governance strategy, approach, and road map for the data relevant to the Secondary data…",2022-07-26,Not Disclosed,[],
data analyst,Wakefit,"Bengaluru, Karnataka","Performing and documenting data analysis, data validation, and data mapping/design.,Creating tools to store data within the organization.",2022-07-26,Not Disclosed,['data analysis'],
clinical data manager iii,Clinipace,India,"Developing data management guidelines and study documentation.,Identification of data issues and query generation.,Review of CRF design against protocol.",2022-07-26,Not Disclosed,[],
director - data science and business analytics,Standard Chartered,"Bengaluru, Karnataka","Drive Innovation by incorporating AI, Machine Learning, and data science frameworks to leverage the power of data.,Experience/Exposure with big data technology.",2022-07-26,Not Disclosed,"['machine learning', 'big data']",
big data administrator,Valiance Solutions,"Noida, Uttar Pradesh","Using strong data science, data engineering & cloud engineering.,Hands-on experience with Hadoop deployment.,Ambari, Hive, Nifi, Spark, etc.",2022-07-26,Not Disclosed,"['hadoop', 'spark']",
data analyst,Wakefit,"Bengaluru, Karnataka","Performing and documenting data analysis, data validation, and data mapping/design.,Creating tools to store data within the organization.",2022-07-26,Not Disclosed,['data analysis'],
data scientist,TARGET,"Bengaluru, Karnataka","Ability to write modular code and data pipelines which can be automated and scaled.,Coding and development of next generation optimization models that leverage…",2022-07-26,Not Disclosed,[],
datastage support developer(junior),FENG GROUP,"Patna, Bihar+1 location","Knowledge of data modeling, database design, and the data warehousing ecosystem;,Develop ETL Datastage jobs, SQL scripts, UNIX scripts Performs data profiling,…",2022-07-26,Not Disclosed,"['sql', 'etl']",
