job_title,company,job_location,job_summary,today,job_salary,extracted_skills,yearly_salary
graduate engineer trainee - data analyst,RBHU ETG Private Limited,"Navi Mumbai, Maharashtra","Create data governance policies like RLS to manage data security.,Python/R for data science.,Access data stored in databases/warehouses/flat files.",2022-07-26,"₹4,00,000 - ₹6,14,481 a year","['python', 'r']",507240.5
data analyst: full time,Heart It Out,"Bengaluru, Karnataka","Should be comfortable with data viz tools like tableau , data studio etc.,Developing software and data models.,Manages and improves existing reporting systems.",2022-07-26,Not Disclosed,['tableau'],
business intelligence analyst,SafeGuard Global,Remote,"Analyse and understand requests for data sets; create, test and deliver these data sets to consumers as required.,Provide a high standard of customer care.",2022-07-26,Not Disclosed,[],
sustainability analyst,Rystad Energy,"Bengaluru, Karnataka","Analytical and solid experience within data management/handling.,Research, gather, clean and analyze data related to oil and gas emissions product portfolio.",2022-07-26,Not Disclosed,[],
data analyst power bi with python,Intellecto Global Services,"Chennai, Tamil Nadu","O Good to have : Working knowledge of data warehousing infra tools like Hive.,O Attention to detail and strong data orientationo Ability to adapt to and learn…",2022-07-26,"₹25,000 - ₹28,000 a month",[],318000.0
data analyst,AlphaExpression Technologies,"Pattom, Thiruvananthapuram, Kerala","Study and convert functional requirements into technical tasks.,Analyse, calculate and provide estimates.,Ensure the product meets the requirements.",2022-07-26,Not Disclosed,[],
bi data analyst,Logitech,"Chennai, Tamil Nadu","The data analyst is responsible for collecting and analyzing internal & external data for reporting.,Defining new data collection processes and analysis on data…",2022-07-26,Not Disclosed,[],
research analyst,ITP Software India Pvt. Ltd,"Hyderabad, Telangana","Collecting data from sources such as public opinion surveys and election results 3.,As a researcher you should be able to study the development of political…",2022-07-26,"₹25,000 - ₹50,000 a month",[],450000.0
data analyst - senior analyst,Deloitte,"Bengaluru, Karnataka","Deep understanding of Performance Management systems, HR data and reporting.,This role will also require expertise on MS Excel - VBA for analysis across the…",2022-07-26,Not Disclosed,['excel'],
junior analyst,GfK,"Gurgaon, Haryana","To meet the agreed daily/weekly/monthly targets and deadlines.,To meet or exceed productivity benchmarks for Junior Analyst’s targets.",2022-07-26,Not Disclosed,[],
data analyst,Relevance Lab,"Bengaluru, Karnataka","Must be experienced with large volume data analysis.,Gather requirements & create the data pipeline which will be used by Tableau Developer.",2022-07-26,Not Disclosed,"['tableau', 'data analysis']",
mis data analyst,Vantage Circle,"Guwahati, Assam","Maintain a thorough understanding of data and information resources.,Perform data analysis for generating reports on a periodic basis.",2022-07-26,Not Disclosed,['data analysis'],
job data analytics,CODERS BRAIN TECHNOLOGY PRIVATE LIMITED,Remote,"Works with data analysts to ensure QA, Launch and Post Launch validations.,Adobe Target Implementation - Focus on Web.,Total work: 8 years (Preferred).",2022-07-26,Not Disclosed,[],
analyst-online ops and resolution,Lowe's,"Bengaluru, Karnataka","The Data & Analytics teams help make data-driven decisions in merchandising, store operations, finance, and supply chain.,3+ years of work experience.",2022-07-26,Not Disclosed,[],
data and infrastructure analyst,Bechtel,Andaman and Nicobar Islands,"Large scale data entry from various source media.,Entering data into a Geographic Information System (GIS) environment.",2022-07-26,Not Disclosed,[],
technical business analyst,Vv Consultancy,"Bengaluru, Karnataka","Approve data model changes as a Data Team Reviewer and code owner for specific database and data model schemas.,Programming languages such as Python or R;",2022-07-26,"₹40,000 a month","['python', 'r']",480000.0
analyst-data maintenance,Accenture,"Bengaluru, Karnataka+1 location","The role may also need expertise in managing clinical data management projects.,The team is responsible for performing data management activities including…",2022-07-26,Not Disclosed,[],
data analyst,Sri Renga Global,"Tiruchchirappalli, Tamil Nadu",Skill : knowledge in system and ms office.,2022-07-26,"₹5,000 - ₹6,000 a month",[],66000.0
data analyst,Futurism,"Pune, Maharashtra","Performs regular backups to ensure data preservation.,Any data scraping tools knowledge will add an advantage.,Strong written and verbal communication skills.",2022-07-26,Not Disclosed,[],
data management & spend analysis,Skyleaf Consultants,"Gurgaon, Haryana","The position shall be responsible for data management and performing Spend.,The position shall be responsible for helping sourcing team as well as multiple…",2022-07-26,Not Disclosed,[],
mis & data analytics,Megara Infotech,"Gurgaon, Haryana","Maintaining data in Excel (includes Formula (Sum, count, if), Pivot Table,H-Look Up, V-Look Up.,Typing in the English language without spelling mistakes.",2022-07-26,Not Disclosed,['excel'],
data analyst - sql,Aon Corporation,"Bengaluru, Karnataka",Bachelors or Master Degree or University Degree or equivalent with including 1 to 3 years of relevant experience as a Data Analyst with SQL experience.,2022-07-26,Not Disclosed,['sql'],
bi analyst,Haven Infoline Pvt Ltd.,"Mumbai, Maharashtra","# Acquire data from primary or secondary data sources and maintain databases/data systems.,# Technical expertise regarding data models, database design…",2022-07-26,"₹20,000 - ₹30,000 a month",[],300000.0
data analyst,Decision Tree,"Gurgaon, Haryana","Perform data research, analysis, and logical data modeling to validate and document the usage of business data artifacts.,Identify and analyze target segments.",2022-07-26,Not Disclosed,[],
research analyst,Alchemy Research and Analytics,"Durgapur, West Bengal","Strong analytical and data gathering ability.,Rapid research - data collation and presentation from databases or Internet search.",2022-07-26,"₹2,40,000 a year",[],240000.0
data analyst,Varsity Educational Management Pvt. Ltd,"Jubilee Hills, Hyderabad, Telangana","Hope you are doing great and we need urgent candidate for data analyst with good techinical knowledge.,R or Python-Statistical Programming.",2022-07-26,"₹30,000 a month","['python', 'r']",360000.0
data operations analyst,Clearstate Pte. Ltd,"Gurgaon, Haryana","The candidate will provide data upload and reporting insights, implementation of activities against data pulls, and help improve the quality of customer data.",2022-07-26,Not Disclosed,[],
power-bi specialist,EPC Group,Remote,"Knowledge on Connecting multiple data sources, importing data, and transforming data for Business Intelligence.,Extensive experience with M and DAX functions.",2022-07-26,"₹70,000 a month",[],840000.0
senior data engineer/bia analyst,Danske Bank,"Bengaluru, Karnataka","SQL, SAS, Hadoop, Hive, ETL, Spark, Scala, DataStage.",2022-07-26,Not Disclosed,"['sql', 'hadoop', 'spark', 'etl']",
data analyst,PipeCandy,"Chennai, Tamil Nadu",Collaborate and work closely with data quality teams to ensure adherence to data ingestion and data governance standards.,2022-07-26,Not Disclosed,[],
supply chain analyst,Shell,"Bengaluru, Karnataka","Strong analytical abilities, able to handle and interpret large volumes of data, and out of box thinking to provide valuable insights on economic, technical,…",2022-07-26,Not Disclosed,[],
cybersecurity analyst for cybersecurity operations,Siemens,"Pune, Maharashtra","As a Security Analyst, you will.,Monitor and review notable events in Splunk Enterprise Security dashboards.,Resolve false positives and communicate effectively…",2022-07-26,Not Disclosed,[],
associate client data analyst,FIS Global,"Pune, Maharashtra","Utilizes systems and data to resolve business issues in the most effective and productive manner.,Experienced (relevant combo of work and education).",2022-07-26,Not Disclosed,[],
data analyst,BatchService,Remote,"We are looking for an experienced data analyst, preferably with additional data science, machine learning and AI experience.",2022-07-26,Not Disclosed,['machine learning'],
data investigations analyst,Standard Chartered,"Chennai, Tamil Nadu","Proactive identification of data quality issues arising across client data domains, and risks emanating from them.,Internal audits and Quality assurance.",2022-07-26,Not Disclosed,[],
analyst,EY,"Gurgaon, Haryana","Co-ordinate with the team and assist in creating process management templates, trackers using excel to make the data management, reporting, monitoring steps…",2022-07-26,Not Disclosed,['excel'],
firmwide regulatory reporting & analysis (frra) - data & pla...,"JPMorgan Chase Bank, N.A.","Bengaluru, Karnataka","Drive completeness and accuracy of data through data sourcing, data validations, data adjustments, and data reconciliations.",2022-07-26,Not Disclosed,[],
analyst-clinical data management (cdm),Accenture,"Bengaluru, Karnataka+1 location","The team also managing clinical data management projects.,The team is responsible for performing data management activities including discrepancy review, query…",2022-07-26,Not Disclosed,[],
content analyst - drug forecast,Clarivate,"Hyderabad, Telangana","Ability to research and synthesize data and information.,Responsible for accurate interpretation of data relevant to drugs in the form of research and analysis.",2022-07-26,Not Disclosed,[],
intern - business analyst,Climate Connect,Remote,"Ability to analyze data using Microsoft Excel, Word, Powerpoint, etc.,With flexible hours and merit-based reward systems, we offer tremendous potential for…",2022-07-26,Not Disclosed,['excel'],
data/business analyst,TrueCover,India,"Collating data from various sources.,Love, eat and pray sanity of data.,Analyse data and bring out the story it represents.",2022-07-26,Not Disclosed,[],
data analyst-tech,Chqbook,"Gurgaon, Haryana","Compile and analyze data related to business' issues.,Develop clear visualizations to convey complicated data in a straightforward fashion.",2022-07-26,Not Disclosed,[],
senior performance data analyst,Deutsche Bank,"Mumbai, Maharashtra","Ensure that quarterly or annual data updates are timely processed and uploaded.,Oversight and development of the total EMEA & APAC DWS Real Estate performance…",2022-07-26,Not Disclosed,[],
analyst -trading analytics data team,Cargill,"Gurgaon, Haryana","Minimum of two years of experience with data or data warehousing systems.,Partner with and support other data analysts to validate quality and coverage of…",2022-07-26,Not Disclosed,[],
data analyst,Surgical Notes RCM LLC,"Noida, Uttar Pradesh","Leverage data from Salesforce and other reporting platforms to analyze data and convert information into insight.,Speaking and listening on a telephone.",2022-07-26,Not Disclosed,[],
eyeota | business intelligence analyst,Eyeota,Remote,"5-8 years’ work experience in a business intelligence or analyst role.,Deliver ad-hoc data extracts for day-to-day business decision making.",2022-07-26,Not Disclosed,[],
business analyst,Shell,"Bengaluru, Karnataka","Work with Process Experts / Process Excellence Team, IT Advisors and Product Managers for streamlined delivery on Tax L&F Requirements.",2022-07-26,Not Disclosed,[],
data analyst,Bombay Play,"Bengaluru, Karnataka","Prototyping new ways to visualise and understand data relationships.,You will find that this role will challenge you to combine your computational & statistical…",2022-07-26,Not Disclosed,[],
data analyst,NEXTWAVE MULTIMEDIA,"Royapettah, Chennai, Tamil Nadu","Coordinate with both Strategic and development team explaining data insights and predictions.,Good experience with SQL, data modeling, dashboarding and…",2022-07-26,Not Disclosed,['sql'],
data analyst,V-Align Technologies,"Bengaluru, Karnataka",Candidates with 1 to 2 years’ experience statistical data analysis.,2022-07-26,Not Disclosed,['data analysis'],
mis analyst,A & J Global Solutions Private Limited,"Hyderabad, Telangana","Acquire data from primary or secondary data sources and maintain databases/data systems.,Ensure the data quality and integrity in databases.",2022-07-26,"₹4,00,000 - ₹6,00,000 a year",[],500000.0
senior data analyst,Flipkart,"Bengaluru, Karnataka","Design and develop complex data queries to move and transform data from operational data sources to analytical databases.,Understanding of macros is beneficial.",2022-07-26,Not Disclosed,[],
data analyst,Hudson Data,India,"Compile and analyze data related to business issues.,You think about data in terms of statistical distributions and have a big enough analytics toolbox to know…",2022-07-26,Not Disclosed,[],
analyst - bing,InMobi,"Bengaluru, Karnataka","Experienced using Excel to analyze information,Advance Excel, SQL, including data manipulation and data analysis.,2+ years search or digital media experience.",2022-07-26,Not Disclosed,"['sql', 'excel', 'data analysis']",
sr data warehouse analyst,Honeywell,"Bengaluru, Karnataka","Experience with SSIS and general administrative data experience.,Understanding of best-in-class model and data configuration and development processes.",2022-07-26,Not Disclosed,[],
data analyst,Targray,"Gurgaon, Haryana","Developing and maintaining databases, data systems – reorganizing data in a readable format.,Technical proficiency regarding database design development, data…",2022-07-26,Not Disclosed,[],
analyst / sr. analyst - us strategy & research,Deloitte,"Gurgaon, Haryana","And be able to advise/direct others to find the best data/research quickly and reliably.,Know a wide variety of secondary data sources (e.g. Factiva, Capital IQ…",2022-07-26,Not Disclosed,[],
data business analyst | 3 to 7 years | mumbai/bengaluru/pune,Capgemini,"Mumbai, Maharashtra","Good to have knowledge of data transformation, data mapping, operations, and basics of ETL tools.,Basics of data analysis using R/ Python etc.",2022-07-26,Not Disclosed,"['python', 'r', 'etl', 'data analysis']",
financial data analyst - esg,ZM Financial Systems,"Bengaluru, Karnataka",Liaise with analysts in order to understand and report the findings and observations of data needed for analysis and publications.,2022-07-26,Not Disclosed,[],
data analyst,HotelHub,"Bengaluru, Karnataka","New data collection from internet.,String data mapping skills by joining multiple tables in SQL DB.,Bachelor or Master degree in Science or Information…",2022-07-26,Not Disclosed,['sql'],
business analyst,EY,"Bengaluru, Karnataka","Designs functional specifications of applications to address business and user needs.,Identifies internal and external factors which may impact requirements.",2022-07-26,Not Disclosed,[],
data operation analyst i ( r- 12502),Dun & Bradstreet,"Mumbai, Maharashtra","Ensuring full accuracy of data and quality.,Designation: Data Operations Analyst Department: Finance Solutions, Risk & Compliance.",2022-07-26,Not Disclosed,[],
security analyst,NTT Ltd,"Hyderabad, Telangana","Knowledge of and experience with databases (writing queries, analyzing data, developing reports, etc.).,Knowledge of and experience with any security tools…",2022-07-26,Not Disclosed,[],
mis - data analyst 1,EY,"Bengaluru, Karnataka","Using statistical tools to interpret data sets, propose data points with patterns that could be valuable for diagnostic and predictive analytics efforts.",2022-07-26,Not Disclosed,[],
data analyst,predera,"Hyderabad, Telangana","Proven working experience as a data analyst.,Acquire data from primary or secondary data sources and maintain databases/data systems.",2022-07-26,Not Disclosed,[],
cib_client data analyst_operations specialist,"JPMorgan Chase Bank, N.A.","Hyderabad, Telangana","T o create and maintain Client Reference data basis of firm wide approved standard documentation.,Party Reference Data Utility is responsible for timely and…",2022-07-26,Not Disclosed,[],
financial data analyst - sfg,Moody's,"Bengaluru, Karnataka","Identify trends/deviations in data and use analytical ability to form well thought out credit conclusions.,Support monitoring/surveillance of issuers by e.g.…",2022-07-26,Not Disclosed,[],
data analyst - bpo / bpm,Zensar Technologies,"Pune, Maharashtra","2+ years experience as Data Analyst in business ops support fuction.,Hands on knowledge on Process execution and support.,Ready to work in graveyard shift.",2022-07-26,Not Disclosed,[],
its tranfer pricing - advanced analyst,EY,"Kolkata, West Bengal+1 location","To work with accounting and financial data, analyze, and perform financial adjustment calculation.,To demonstrate a basic understanding of economic principles…",2022-07-26,Not Disclosed,[],
senior clinical data analyst,Calyx,"Hyderabad, Telangana","Your hard work will be rewarded with a competitive salary and discretionary performance bonus.,The benefits package includes 25 days' holiday per year, pension…",2022-07-26,Not Disclosed,[],
senior analyst-data support l2,Schneider Electric,"Gurgaon, Haryana",PIM L2 Data Support specialist Purpose of the position The role is necessary for Supporting the PIM/EDMS data within the framework of End to End Service with…,2022-07-26,Not Disclosed,[],
data analyst,"Mojocare, Alpha Digital Health","Bengaluru, Karnataka","As a data analyst, you will be responsible for compiling actionable insights from data and assisting program, sales and marketing managers build data-driven…",2022-07-26,Not Disclosed,[],
"business analyst - strategy , research and product developme...",Climate Connect,Remote,"Skilled in organising the team's knowledge and body of work using various products and data management tools.,Collaborate on creating key research deliverables,…",2022-07-26,Not Disclosed,[],
data management analyst,Honeywell,"Bengaluru, Karnataka","5+ years of experience working in a data warehouse environment and a strong understanding of dimensional data modeling concepts.,Sound ETL knowledge in SSIS.",2022-07-26,Not Disclosed,['etl'],
data analyst or senior data analyst,Mothersonsumi INfotech & Designs,"Noida, Uttar Pradesh","Initiate and complete – project cycle activities like data collection, integration, clean, data analysis, visualization, feature engineering etc.",2022-07-26,Not Disclosed,['data analysis'],
data manager - engineering and bi,Dexndot Solutions,"Bengaluru, Karnataka","Coordinate with data generator and ensure compliance to all enterprise data model according to data.,Build data models, data visualizations and automated…",2022-07-26,"₹35,00,000 a year",[],3500000.0
data security analyst in mnc,SakeeSoft Pvt Ltd,"Bengaluru, Karnataka","Ensure proper and authorized access to data systems.,GAC Analyst Job Description: Enterprise Information Security team in need of an Information Security…",2022-07-26,"₹15,000 - ₹25,000 a month",[],240000.0
data steward analyst,JLL,"Bengaluru, Karnataka","The role will have wide range of responsibilities including data extraction, data cleansing, researching multiple data sources to support Master Data Management…",2022-07-26,Not Disclosed,[],
data analyst - subscription management,Arcadia,"Chennai, Tamil Nadu",Prior experience with data analysis in finance / billing / payments / energy domain or working in similar roles (data analyst) is preferred.,2022-07-26,Not Disclosed,['data analysis'],
data analyst,Study Group,"Noida, Uttar Pradesh","Working knowledge in analyzing e-commerce data and paid advertising data.,Tasks: Convert and integrate complex data from multiple data source into dashboards,…",2022-07-26,Not Disclosed,[],
data analyst,TLC,"New Delhi, Delhi","Responsible for tracking, reporting, and analyzing the performance of marketing activities, ad-hoc analytic requests, and development/automation of regular…",2022-07-26,Not Disclosed,[],
"analyst, data quality",Evolent Health,"Temporarily Pune, Maharashtra","Activities include: Define and maintain data standards, definitions, and models (e.g. data dictionary, organizational data model.",2022-07-26,Not Disclosed,[],
data scientist / analyst,Deutsche Bank,"Bengaluru, Karnataka","Intermediate to advanced knowledge in data science, big data tools and infrastructural components – Hadoop / PySpark / Jupyter.,Best in class leave policy.",2022-07-26,Not Disclosed,"['big data', 'hadoop']",
data analyst,Saras Analytics,"Hyderabad, Telangana","We are a group of engineers and analysts focused on improving business performance through data analysis.,Strong mathematical skills to help collect, measure,…",2022-07-26,Not Disclosed,['data analysis'],
business analyst,E2logy Software Solutions,"Noida, Uttar Pradesh","Knowledge of diagrams like data flow, sequence diagrams etc.,Ability to document and analyze required information, and data.",2022-07-26,Not Disclosed,[],
engineer data analyst,International Centre for Entrepreneurship and...,"Ahmedabad, Gujarat","Responsibilities:Interpret data, analyze results using statistical techniques and provide ongoing reportsDevelop and implement databases, data collection…",2022-07-26,Not Disclosed,[],
business/data analyst analytics,Grazitti,"Mohali, Punjab","Should analyze data and presenting data through reports that aid decision-making.,Your role would need a keen eye for detail, experience as a data analyst, and…",2022-07-26,Not Disclosed,[],
business analyst,Your Retail Coach,"Santacruz, Maharashtra","Should be enable to assess various business opportunities and efficiently making data.,Interpret, evaluate and interrelate research data and develop integrated…",2022-07-26,"₹8,50,000 - ₹9,50,000 a year",[],900000.0
data scientist (analyst),Scienaptic Systems,"Bengaluru, Karnataka","Coming up with data driven solutions to control risk.,The Data Scientist role will enable you to be at the forefront of latest cutting-edge technology and…",2022-07-26,Not Disclosed,[],
business analyst i,Amex,"Gurgaon, Haryana+1 location","Generating business insights using data analytics to answer business problems.,Supports management in developing and implementing systems, reengineering…",2022-07-26,Not Disclosed,[],
business analyst,Venture7 Technology Private Limited,"Faridabad, Haryana","Identify systems processes by evaluation of real-time data.,Excellent written and verbal communicator with the ability to translate data into actionable…",2022-07-26,Not Disclosed,[],
data governance solution analyst,Cargill,"Bengaluru, Karnataka",Ensures data integrity and compliance by partnering with stakeholders to learn and educate on the data strategy.,2022-07-26,Not Disclosed,[],
data analyst,Apsidata,"Noida, Uttar Pradesh","✓ 2-4 years of strong experience in Tabulation and Data validation using Quantum.,✓ Proficiency in Quantum scripting tool is essential.",2022-07-26,Not Disclosed,[],
financial analyst i - finance and reporting,Labcorp,"Bengaluru, Karnataka","Ensure all data is complete and accurate in Hyperion.,Utilize wide ranging data sources and systems, developing reports & tools to facilitate a deeper insight…",2022-07-26,Not Disclosed,[],
senior product analyst,Anar App,Remote,"1+ year experience as an analyst with a consumer or marketplace/platform product.,Data and User focused: Balance data insights with user research to drive…",2022-07-26,"₹10,00,000 - ₹15,00,000 a year",[],1250000.0
business analyst,Zignuts Technolab pvt. ltd.,"Gandhinagar, Gujarat","Analyse and document functional requirements to the assigned projects and services as per defined business requirements.,Microsoft Office: 1 year (Preferred).",2022-07-26,"₹6,00,000 a year",[],600000.0
ttt- consultant - business/data analyst,EY,"Bengaluru, Karnataka",Technical data analyst (knowledge of db/ ETL) who has experience in creating/ documenting both business and technical requirements as part of requirement…,2022-07-26,Not Disclosed,['etl'],
senior clinical data analyst,Parexel,India,"Manage all phases of data management activities from study start up to database close.,Minimum Work Experience • Previous relevant working experience preferred,…",2022-07-26,Not Disclosed,[],
junior data mastering analyst,UBS,"Pune, Maharashtra","Identify data gaps and data integrity issues in current data, partner with data owners and IT team to plan resolution.,Experience to guide IT in data solutions.",2022-07-26,Not Disclosed,[],
senior analyst- risk in change,Commonwealth Bank,"Bengaluru, Karnataka","Responsible for data quality in & maintenance of various databases in all tools used.,Ability to think critically and analytically and use data driven insights…",2022-07-26,Not Disclosed,[],
materials mgmt analyst i,Honeywell,"Bengaluru, Karnataka","Champion data quality initiatives and drive data accuracy across all phases of material data management.,Previous experience as SAP Material Master process…",2022-07-26,Not Disclosed,[],
data and dialler analyst,Webhelp,"Gurgaon, Haryana","Clearly articulating and facilitating data analytical findings to stakeholder at all levels.,Ensuring the supply of data, supporting analytics and reports to…",2022-07-26,Not Disclosed,[],
data analyst,Anton Tech Private Limited,"Kolathur, Chennai, Tamil Nadu","Acquiring data from primary and secondary data sources and maintaining databases/data systems.,Managing, creating, updating and master data.",2022-07-26,"₹10,000 - ₹18,000 a month",[],168000.0
