job_title,company,job_location,job_summary,today,job_salary,extracted_skills,yearly_salary
technical and content writer,Bosch Group,"Bengaluru, Karnataka","It will also provide you with the opportunity to establish effective communication programmes that promote and protect BGSW’s vision, strategy, values, and…",2022-07-26,Not Disclosed,[],
software engineer,GE Digital,"Hyderabad, Telangana+1 location","Learns organization vision statement and decision making framework.,Learns organization vision statement and decision making framework.,In this role, you will:",2022-07-26,Not Disclosed,[],
quality engineer,Barclays,"Pune, Maharashtra","We aim to foster a culture where individuals of all backgrounds feel confident in bringing their whole selves to work, feel included and their talents are…",2022-07-26,Not Disclosed,[],
automation test engineer,amdocs,"Gurgaon, Haryana+1 location","We offer a wide range of stellar benefits including health, dental, vision, and life insurance as well as paid time off, sick time, and parental leave!",2022-07-26,Not Disclosed,[],
cyber security risk and compliance- analyst/senior analyst,Deloitte,"Bengaluru, Karnataka","Our vision is to create a leadership culture focused on the development and well-being of our people.,Bachelor’s degree in computer science or equivalent…",2022-07-26,Not Disclosed,[],
senior analyst customer applications support,SITA,India,"We design, build, and support technology solutions all with one vision to create easy air travel every step of the way.,Basic understanding of C# and .",2022-07-26,Not Disclosed,[],
system testing - lte enodeb,Mavenir,"Bengaluru, Karnataka","Bachelor/ Master’s degree in computer science, electrical engineering is required.,Mavenir is building the future of networks and pioneering advanced technology…",2022-07-26,Not Disclosed,[],
automation testing with hp qtp and uft,Saraca Solutions,"Bengaluru, Karnataka","Bachelors/Master’s degree (B.E/B.Tech/MCA/M.Tech) in computer science, computer engineering, software engineering, or equivalent.",2022-07-26,Not Disclosed,[],
security and controls administrator,The Coca-Cola Company,"Bengaluru, Karnataka","A bachelor’s in computer science, Information Technology or a related field of study is preferred.,D365 Security and Controls Administrator will be responsible…",2022-07-26,Not Disclosed,[],
technical program manager,Plume,"Bengaluru, Karnataka","At Plume, we believe that technology isn't about moving faster, it's about making life's moments better.,Which is why we've built the world's first, and only,…",2022-07-26,Not Disclosed,[],
talent acquisition manager,VisionIAS | Ajayvision Education Private Limited,"Temporarily Delhi, Delhi","In this light, we provide unique learning experiences through our web-based platforms, computer and mobile applications enabled with Artificial intelligence and…",2022-07-26,"₹5,00,000 - ₹12,00,000 a year",[],850000.0
data operations associate,Consilio LLC,"Bengaluru, Karnataka",Associate - Data Operations' role at Consilio requires deep understanding of file structures and forensic images to ingest electronic data into our proprietary…,2022-07-26,Not Disclosed,[],
technical program manager,Plume,"Bengaluru, Karnataka",Plume develops and deploys cloud-based control planes with scale to manage 10s of millions of customer homes through some of the world's largest ISPs.,2022-07-26,Not Disclosed,[],
talent acquisition manager,VisionIAS | Ajayvision Education Private Limited,"Temporarily Delhi, Delhi","In this light, we provide unique learning experiences through our web-based platforms, computer and mobile applications enabled with Artificial intelligence and…",2022-07-26,"₹5,00,000 - ₹12,00,000 a year",[],850000.0
data operations associate,Consilio LLC,"Bengaluru, Karnataka",Associate - Data Operations' role at Consilio requires deep understanding of file structures and forensic images to ingest electronic data into our proprietary…,2022-07-26,Not Disclosed,[],
software engineer ii,HERE Technologies,"Mumbai, Maharashtra","You will work on projects focused on delivery of real-time traffic and will participate in all stages of software development including refining product vision,…",2022-07-26,Not Disclosed,[],
software engineer,Microsoft,"Hyderabad, Telangana+2 locations","CSCP is responsible for strategic sourcing, customer demand forecasting, capacity planning and management, supply chain planning and execution, capacity…",2022-07-26,Not Disclosed,[],
image processing engineer,Optimized Electrotech Pvt Ltd,"Bengaluru, Karnataka","Competency in developing semantic analysis schemes for images through image interpretation, object tracking, object detection, computer vision related…",2022-07-26,"₹14,00,000 - ₹20,00,000 a year",[],1700000.0
sales head,PropertyXpo Services Pvt.Ltd,"Gurgaon, Haryana","Communicate and embody the company vision and values.,The Associate Vice President & Sales Head - Real Estate Portfolio Management, It a team management role…",2022-07-26,"₹4,89,498 - ₹17,06,758 a year",[],1098128.0
marketing executive,Videoverse,"Mumbai, Maharashtra","Familiarity with marketing computer software and social media platforms.,Role – Marketing Executive (On-site)*.,Assisting with daily administrative duties.",2022-07-26,"₹3,00,000 - ₹4,00,000 a year",[],350000.0
social media executive,RailMitra,"Patna, Bihar","Excellent writing and computer skills.,We are looking for a Social Media Marketing Executive to help strengthen our brands' & accounts' Social presence.",2022-07-26,Not Disclosed,[],
senior machine learning engineer (computer vision),Atai labs,"Hyderabad, Telangana","Responsible for designing and building production class deep learning models applied to computer vision problems.,Guide and mentor junior engineers on the team.",2022-07-26,Not Disclosed,['deep learning'],
systems test engineer,Philips,"Hybrid remote in Bengaluru, Karnataka","Lead software and system testing activities.,Create test plans and test strategies for multiple concurrent projects.,Interface with cross functional teams.",2022-07-26,Not Disclosed,[],
game artist (junior/mid/ experienced),BigDay Studio Pvt Ltd,"Noida, Uttar Pradesh","Work closely with the lead artist understand the overall game vision and quality goals.,Work closely with concept artists, the lead artist and the content…",2022-07-26,"₹18,000 - ₹70,000 a month",[],528000.0
senior front-end engineer,BlueOptima,"Bengaluru, Karnataka","Great chance to get a taste of other domains as well working together with BE and UX teams.,The person would be leading a team of FE engineers in India which…",2022-07-26,Not Disclosed,[],
data scientist,Testbook,"Navi Mumbai, Maharashtra","You train under the best mentors and become an expert in your field in your own right.,Now is the time to join the force.",2022-07-26,Not Disclosed,[],
orcas -c#,Aptiv,"Bengaluru, Karnataka","Camera-based computer vision systems.,We are setting up a dream team that will jointly develop and maintain vehicle data logging and visualization tool, which…",2022-07-26,Not Disclosed,[],
technical staff – ems team – in-4,Altiostar,"Bengaluru, Karnataka",Our objective is to provide mobile network operators with the equipment required to deploy and expand their 4G/5G networks quickly and efficiently in the most…,2022-07-26,Not Disclosed,[],
orcas -c#,Aptiv,"Bengaluru, Karnataka","Camera-based computer vision systems.,We are setting up a dream team that will jointly develop and maintain vehicle data logging and visualization tool, which…",2022-07-26,Not Disclosed,[],
java developer,Oracle,"Bengaluru, Karnataka+2 locations","Junior consulting position for those who are continuing to develop their expertise.,Receives general instruction on routine work and detailed instruction on new…",2022-07-26,Not Disclosed,[],
junior frontend developer,New Vision Group Holding P. Ltd,"Pune, Maharashtra","Build 2D and 3D applications using fabric.js, webgl/three.js, and React.js.,Develop technical specifications and requirements.,Total work: 3 years (Preferred).",2022-07-26,"₹40,000 - ₹50,000 a month",[],540000.0
website development lead,InnoServ Digital,"Pune, Maharashtra","Understanding company vision and strategy.,This role will be overseeing a project from conception to implementation, client coordination, managing the needs…",2022-07-26,Not Disclosed,[],
it application developer,Lenovo India Private Limited,"Bengaluru, Karnataka","Bachelor's Degree (degree in information systems technology or computer information system management preferred).,Popular database knowledge is required.",2022-07-26,Not Disclosed,[],
operation engineer-12,Mavenir,"Bengaluru, Karnataka","Specializes in providing assistance to field engineers, technicians, and product support in diagnosing, troubleshooting, repairing and debugging complex systems…",2022-07-26,Not Disclosed,[],
c# developer,Siemens,"Bengaluru, Karnataka",Interact with customers and other team members to build and verify the solutions via the requirements and technical specifications.,2022-07-26,Not Disclosed,[],
computer science teacher,Pi Jam Foundation,"Bengaluru, Karnataka+1 location","Be an intellectually curious and responsive team contributor, delivering and receiving feedback regularly, and eager to learn and stay up to date on computer…",2022-07-26,"₹20,000 - ₹28,000 a month",[],288000.0
business technical analyst,Kiash Soluitons LLP,"Hyderabad, Telangana","Identify the main vision and objectives of the application to be developed.,Reviews, analyzes, and creates detailed documentation of business systems and user…",2022-07-26,"₹2,95,070 - ₹9,50,318 a year",[],622694.0
developer ii - software engineering,UST Global,"Hyderabad, Telangana","Gather and drive stakeholder requirements and product vision through the planning, analysis, development, and testing phases.,Create and conduct unit testing.",2022-07-26,Not Disclosed,[],
cinematographer,TheBroThing,"Faridabad, Haryana","You need a computer to edit on, ideally a laptop because we travel sometimes.,Edit videos, make them engaging with sound effects, additional B-roll, music, and…",2022-07-26,"₹40,000 - ₹50,000 a month",[],540000.0
computer operator,VCART Vehicles Private Limited,"Raipur, Chhattisgarh","Min 1 year as a computer operator/assistant.,The main objective as Computer Operator/Assistant would be to manage computer related works, call/followup with the…",2022-07-26,"₹8,000 - ₹12,000 a month",[],120000.0
computer hardware & networking executive,Kalparatu Multiplier,"Bhopal, Madhya Pradesh","Providing support for software, hardware, Network and Server for an organizations employees.,Providing all configuration settings in thin client user.",2022-07-26,Not Disclosed,[],
ref133606y_exp3dmlft_application development for data servic...,Robert Bosch,"Bengaluru, Karnataka","Exposure to computer vision, machine learning & deep learning(preferred but not mandatory).,Strong skills in python coding (mandatory).",2022-07-26,Not Disclosed,"['python', 'machine learning', 'deep learning']",
ar/vr developer,Asista Software Solutions Private Limited,"Chennai, Tamil Nadu+1 location","1-5 years of experience in developing AR/VR, Computer vision applications.,Follow adopted design/development methodologies, patterns, and toolsets.",2022-07-26,"₹4,50,000 - ₹5,00,000 a year",[],475000.0
machine learning developer,Tech Opportunity,"Andheri, Mumbai, Maharashtra","Skills - Open CV, Deep Learning, Object detection and recognition, computer vision.,Andheri, Mumbai, Maharashtra: Reliably commute or planning to relocate…",2022-07-26,"₹2,50,000 - ₹6,50,000 a month",['deep learning'],5400000.0
help desk support – level 2,ACE IT Solutions,"Chandigarh, Chandigarh","Providing support for computers, peripherals, and user related questions.,These duties include configuration, installations, and troubleshooting software and…",2022-07-26,Not Disclosed,[],
it recruiter,E - Hireo,"Bengaluru, Karnataka","Source, screen and headhunt talents through various job portals, social media, and employee referrals.,Identifying candidates with right skills to match the…",2022-07-26,"₹15,000 a month",[],180000.0
csce automation systems architect,Intel,Hybrid remote in India,CS creates an environment where employees can prosper while creating the innovative technologies that make amazing possible.,2022-07-26,Not Disclosed,[],
artificial intelligence and computer vision specialist,JSR Dynamics,"Nagpur, Maharashtra","Strong grasp over concepts in computer vision.,Artificial Intelligence and Computer Vision Specialist:,Implementing Computer Vision algorithms for automatic…",2022-07-26,Not Disclosed,[],
qa automation engineer,ZADARA STORAGE,"Bengaluru, Karnataka","Bachelor’s degree in computer science or equivalent.,You will be a part of our Automation Team and focus on developing the automation infrastructure and tests…",2022-07-26,Not Disclosed,[],
data and quality analyst,BCD Travel Corporate,"Bengaluru, Karnataka","§ Requires clarity of near vision.,College degree, preferably in the computer related field, or equivalent technical work experience.",2022-07-26,Not Disclosed,[],
lead - digital,Pehlay Akshar Foundation,"Mumbai, Maharashtra","Define the product vision, scope and translating the product vision in user-friendly application.,Governments to implement programs that change the way students…",2022-07-26,"₹8,00,000 - ₹10,00,000 a year",[],900000.0
software development engineer ii,Philips,"Hybrid remote in Bengaluru, Karnataka","Own the detailed design of the system.,Comfortable in design, implementation, testing, and documentation.,Ensure quality by writing developer level tests (unit,…",2022-07-26,Not Disclosed,[],
strategy officer,Bosch Group,"Bengaluru, Karnataka","Portfolio management, evolving go to market strategy execution, business model evolution, business development including strategic alliances, channel partners …",2022-07-26,Not Disclosed,[],
computer vison engineer,i2V Systems,"Gurgaon, Haryana","Deploying computer vision solutions on scale.,You will be responsible for development and optimization of various computer vision solutions which solve customer…",2022-07-26,Not Disclosed,[],
data scientists,DeepTek Medical Imaging,"Temporarily Pune, Maharashtra",Your responsibilities will include the development and evaluation of neural network models for computer vision and medical imaging tasks based on state-of-art…,2022-07-26,Not Disclosed,[],
it specialist,BizBox Publishing,Remote,"Software is everything running on the cloud or on a computer or mobile device.,Best in class Leave Policy.,Bizbox clients make up a variety of market leaders in…",2022-07-26,Not Disclosed,[],
machine learning engineer,Oracle,"Bengaluru, Karnataka","Good understanding of OpenCV and related computer vision libraries.,Design, develop, troubleshoot and debug software programs for databases, applications, tools…",2022-07-26,Not Disclosed,[],
consultant - automation testing with selenium & c#,Deloitte,"Bengaluru, Karnataka","Since then, nearly all of the Deloitte Tax LLP (“Deloitte Tax”) U.S. service lines and regions have obtained support through Deloitte Tax in India.",2022-07-26,Not Disclosed,[],
staff engineer - moj,sharechat,"Temporarily Bengaluru, Karnataka","Establishing technology vision and best practices for the team, demonstrating how to solve deeply complex technical challenges and helping communicate that…",2022-07-26,Not Disclosed,[],
apprentice engineer,ASM Assembly Systems India Pvt Ltd,"Bengaluru, Karnataka","Siplace and DEK Technician/Engineer Under*.,ASM Assembly systems India Pvt Ltd*.,Any related NSQF approved QP/Course/NOS and code*.,B.E with 9 years +.",2022-07-26,"₹15,000 - ₹20,000 a month",[],210000.0
hr executive,Academia Solutions,"Kalighat, Kolkata, West Bengal","Must be a basic tech savvy person and comfortable with computer usage.,Responsible for understanding the business goals and vision of the company.",2022-07-26,"₹10,000 - ₹15,000 a month",[],150000.0
clinical data lead,ICON - APAC,"Bengaluru, Karnataka","The role: • As a member of staff, the employee is encouraged to accept and supply to our culture of process improvement with a focus on streamlining our…",2022-07-26,Not Disclosed,[],
data analyst,PayU,"Mumbai, Maharashtra+1 location","We are looking for a Data Analyst.,PayU Finance operates under two brands - LazyPay and PaySense with a focus on Buy now Pay later and personal loan products..",2022-07-26,Not Disclosed,[],
noc engineer,Consilio LLC,"Bengaluru, Karnataka","They also ensure smooth functioning of the network for business needs and keeps the downtime to a negligible level.,Good Understanding of Incident Management.",2022-07-26,Not Disclosed,[],
fullstack developer,Altair Engineering,"Bengaluru, Karnataka","You will be part of an international, cross-functional, team that is responsible for the complete software life cycle of the Altair Panopticon product line.",2022-07-26,Not Disclosed,[],
coordinator,Digitals India Secruity Products Pvt. Ltd,"Lucknow, Uttar Pradesh+2 locations","Proficient in computer skills using word processing and spreadsheet programs.,Ability to communicate effectively using speaking, hearing, writing, and vision…",2022-07-26,"₹15,000 - ₹18,000 a month",[],198000.0
mlops engineer (permanent wfh),Master Mind Consultancy,India,Fast-track AI development and deployment related to computer vision and natural language Solutions processing by leveraging our proprietary platforms/frameworks…,2022-07-26,Not Disclosed,[],
staff software engineer (backend),| Hwy Haul,Remote,"Excellent medical, dental and vision benefits.,We are looking for someone who designs and develops technology to serve business and technology objectives,…",2022-07-26,Not Disclosed,[],
developer associate_java | 0-3 yrs | bangalore,SAP,"Bengaluru, Karnataka",SAP Globalization Services broadens SAP’s global footprint by enabling businesses to run efficiently with the vision of empowering them with ‘Local compliance’…,2022-07-26,Not Disclosed,[],
software engineer .net (pune/remote),MINDBODY,"Pune, Maharashtra","You will need dexterity of hands and fingers to operate a computer keyboard.,Software Engineering team works in the MINDBODY software development life cycle,…",2022-07-26,Not Disclosed,[],
business analyst-it,Make Visions Outsourcing Pvt Ltd,"Temporarily Gurgaon, Haryana","Business Analyst (Salary - 8 - 10 Lacs per annum)* Our business analysts are the drivers behind our continued growth and success.,Working knowledge of API’s.",2022-07-26,"₹3,28,871 - ₹10,34,416 a year",[],681643.5
senior software engineer .net (pune/remote),MINDBODY,"Pune, Maharashtra","You will need dexterity of hands and fingers to operate a computer keyboard.,Software Engineering team works in the MINDBODY software development life cycle,…",2022-07-26,Not Disclosed,[],
senior data analyst - data engineering/analytics,Exusia,"Temporarily Bengaluru, Karnataka","Data experience working with complex large datasets / big data performing data analysis, data profiling, data mapping and data modeling is required.",2022-07-26,"₹12,55,575 - ₹28,40,135 a year","['big data', 'data analysis']",2047855.0
data analyst,Osmipro,"Bengaluru, Karnataka","Acquire data from primary or secondary data sources and maintain databases/data systems.,Acquiring data from primary or secondary data sources and maintaining…",2022-07-26,Not Disclosed,[],
senior data analyst,AdTech Holding,"Bengaluru, Karnataka","You know Python - you can get and process data, conduct analytics in Jupyter and visualise results using popular libraries;,Basic knowledge of Airflow DAG;",2022-07-26,"₹80,045 a month",['python'],960540.0
data management analyst,Wells Fargo,Telangana+1 location,"Experience in Data Management concepts including data governance, data domains, data lineage, metadata and/or data quality.",2022-07-26,Not Disclosed,[],
senior data management analyst,Wells Fargo,"Bengaluru, Karnataka+1 location","4+ years of data management experience in one or more of the following functional areas: master, reference data, technology strategy, business technology…",2022-07-26,Not Disclosed,[],
data analyst,SuperK,"HSR Layout, Bengaluru, Karnataka","Acquire data from primary or secondary data sources and maintain databases/data systems.,Providing technical expertise on data storage structures, data mining,…",2022-07-26,"₹7,00,000 - ₹12,00,000 a year",[],950000.0
data analyst,Foxx Life Sciences Pvt Ltd,Remote,"Techniques in data design and data management.,Provide data to users by extracting that data from the ERP system.,Other projects and duties as assigned.",2022-07-26,Not Disclosed,[],
data processing analyst (pipeline - new demand),NielsenIQ,"Chennai, Tamil Nadu","The DPA is responsible for understanding and executing the end-to-end Client deliverable process (needs assessment, operational capabilities, and execution).",2022-07-26,"₹3,60,000 a year",[],360000.0
data analyst,Knowledgehut solutions pvt ltd,"Bengaluru, Karnataka","Managing and maintaining sales data in [redacted] (CRM) and other software programs.,Providing models and organizing statistical studies for the Sales…",2022-07-26,"₹9,00,000 a month",[],10800000.0
data analyst (internship),Probo,India,"Write complex SQL Queries to pull/fetch data from systems.,Identify patterns for user behavior.,Perform analysis and present the findings to stakeholders to…",2022-07-26,Not Disclosed,['sql'],
data analyst,Zocket,"Pune, Maharashtra","1 - 3 years of experience in the data analyst role.,Analysing data using statistical techniques and providing reports.",2022-07-26,"₹8,00,000 - ₹10,00,000 a year",[],900000.0
data analyst,Indus Net Technologies Pvt Ltd,"Kolkata, West Bengal","Acquire data from primary or secondary data sources and maintain databases/data systems.,Technical expertise regarding data models, database design development,…",2022-07-26,Not Disclosed,[],
data analyst,Innowrap Technologies,Remote,"Manual data entry as needed to correct inconsistencies or fix gaps in existing data.,Supervision of both automated and manual processes relating different…",2022-07-26,Not Disclosed,[],
data analyst,GeekFerry,"New Delhi, Delhi","Drive analytics on data for identifying key trends/patterns and generating recommendations.,Recommend actions by analyzing and interpreting data and making…",2022-07-26,"₹25,000 - ₹45,000 a month",[],420000.0
data analyst,UST Global,"Bengaluru, Karnataka+1 location","The job applicant should have experience with the following technologies:,Strong experience in SQL and database design.,Expert knowledge in Microsoft Excel.",2022-07-26,Not Disclosed,"['sql', 'excel']",
data analyst with tableau,VAANTECH,"Hyderabad, Telangana","Experience in analyzing data to draw business-relevant conclusions and in data visualization techniques and tools.,Strong SQL skill is a must.",2022-07-26,"₹17,00,000 a year","['sql', 'data visualization']",1700000.0
data analyst,Textricks Pvt Ltd,"Noida, Uttar Pradesh","Analysing data to identify trends.,Using specialist tools to extract the data needed.,Researching new ways to make use of data.",2022-07-26,"₹1,00,000 - ₹5,00,000 a year",[],300000.0
data analyst,TGS the global skills,"Bengaluru, Karnataka","2+ years data quality or similar level data analysis experience required.,Develop control structures within a simple environment to ensure the accuracy and…",2022-07-26,"₹6,50,000 a year",['data analysis'],650000.0
data analyst,Axismobi,"Noida, Uttar Pradesh","\*Acquire data from primary or secondary data sources and maintain databases/data systems.,\*Develop and implement databases, data collection systems, data…",2022-07-26,"₹15,000 - ₹25,000 a month",[],240000.0
operational analyst,Hestabit Technologies Pvt ltd,"Noida, Uttar Pradesh","Analytical and data visualization skills.,Should have good knowledge of Advance Excel, dashboards, and MIS.,Track and Manage Department operations and Processes…",2022-07-26,"₹7,00,000 a year","['excel', 'data visualization']",700000.0
data analyst - iau,Maruti Suzuki India Ltd,"Gurgaon, Haryana","Hands on experience of data analysis tools/.,Minimum 3 years of relevant experience in data analysis.,Create repeatable data analytics to support continuous…",2022-07-26,Not Disclosed,['data analysis'],
data analyst,Derivatives Connect Private Limited,"Bengaluru, Karnataka","Work experience on data structures, algorithms, and OOPs concepts.,C and C++ Object Oriented Programming Skills.,Should be good in mathematics.",2022-07-26,"₹30,000 - ₹1,00,000 a month",[],780000.0
data analyst- power-bi- sql,T&N Business Services Pvt. Ltd.,"Gurgaon, Haryana","*Experience in dash boarding using google data studio and google sheet to manage schedules, work flow, and statistical data*.,WFH due to Covid situation*.",2022-07-26,"₹4,00,000 - ₹5,00,000 a year",[],450000.0
data analyst intern,GUVI GEEK NETWORK PRIVATE LIMITED,"Temporarily Chennai, Tamil Nadu"," Supporting initiatives for data integrity and normalization., Performing analysis to assess quality and meaning of data., High level knowledge in excel.",2022-07-26,"₹10,000 - ₹15,000 a month",['excel'],150000.0
data analyst,Wizikey,"Gurgaon, Haryana","Performing analysis to assess quality and meaning of data.,Using automated tools to extract data from primary and secondary sources.",2022-07-26,Not Disclosed,[],
data analyst,Zotto Ltd,"Bengaluru, Karnataka","Developing and maintaining databases, data systems – reorganizing data in a readable format.,Technical proficiency regarding database design development, data…",2022-07-26,"₹30,000 - ₹40,000 a month",[],420000.0
